"","DBN","School","Year","Total4","TotalGrad4","AllRegents4","AdvRegents4","Local4","StillEnroll4","DropOut4","Total6","TotalGrad6","AllRegents6","AdvRegents6","Local6","StillEnroll6","DropOut6"
"1","01M292","HENRY STREET SCHOOL FOR INTERNATIONAL STUDIES",2015,73,46,41,0,5,18,7,82,61,53,0,8,6,15
"2","01M448","UNIVERSITY NEIGHBORHOOD HIGH SCHOOL",2015,82,68,58,13,10,5,8,88,72,53,6,19,1,14
"3","01M450","EAST SIDE COMMUNITY SCHOOL",2015,88,75,74,0,1,10,3,75,67,67,0,0,1,6
"4","01M458","FORSYTH SATELLITE ACADEMY",2015,87,13,11,0,2,65,9,118,41,40,0,1,12,60
"5","01M509","MARTA VALLE HIGH SCHOOL",2015,102,45,38,5,7,31,18,63,36,31,4,5,5,18
"6","01M515","LOWER EAST SIDE PREPARATORY HIGH SCHOOL",2015,264,105,103,57,2,83,75,246,110,109,51,1,27,108
"7","01M539","NEW EXPLORATIONS INTO SCIENCE  TECHNOLOGY AND MATH HIG",2015,122,119,119,91,0,2,1,137,134,134,96,0,0,2
"8","01M650","CASCADES HIGH SCHOOL",2015,109,29,29,0,0,64,14,150,116,108,0,8,3,31
"9","01M696","BARD HIGH SCHOOL EARLY COLLEGE",2015,154,148,148,0,0,4,2,123,121,121,0,0,0,1
"10","02M047","47 THE AMERICAN SIGN LANGUAGE AND ENGLISH SECONDARY SC",2015,29,15,13,2,2,12,1,42,35,27,3,8,1,3
"11","02M288","FOOD AND FINANCE HIGH SCHOOL",2015,99,78,67,0,11,14,7,79,74,65,0,9,1,3
"12","02M294","ESSEX STREET ACADEMY",2015,89,70,67,0,3,15,4,75,61,56,0,5,1,13
"13","02M296","HIGH SCHOOL OF HOSPITALITY MANAGEMENT",2015,103,83,71,0,12,18,2,75,56,52,0,4,3,16
"14","02M298","PACE HIGH SCHOOL",2015,98,85,85,17,0,12,1,98,92,92,6,0,0,6
"15","02M300","URBAN ASSEMBLY SCHOOL OF DESIGN AND CONSTRUCTION  THE",2015,108,64,64,0,0,36,8,74,60,59,1,1,4,9
"16","02M303","FACING HISTORY SCHOOL  THE",2015,96,58,57,0,1,20,15,97,66,66,0,0,1,27
"17","02M305","URBAN ASSEMBLY ACADEMY OF GOVERNMENT AND LAW  THE",2015,77,66,57,0,9,8,2,74,66,61,0,5,0,8
"18","02M308","LOWER MANHATTAN ARTS ACADEMY",2015,85,58,49,0,9,15,8,70,59,52,0,7,1,8
"19","02M313","JAMES BALDWIN SCHOOL  THE: A SCHOOL FOR EXPEDITIONARY",2015,135,58,57,0,1,49,25,114,71,68,0,3,10,32
"20","02M316","URBAN ASSEMBLY SCHOOL OF BUSINESS FOR YOUNG WOMEN",2015,75,57,52,15,5,17,1,77,66,57,2,9,2,8
"21","02M374","GRAMERCY ARTS HIGH SCHOOL",2015,113,93,90,9,3,10,6,111,93,88,3,5,7,11
"22","02M376","NYC ISCHOOL",2015,100,98,98,0,0,2,0,96,93,93,0,0,0,3
"23","02M392","MANHATTAN BUSINESS ACADEMY",2015,99,85,76,1,9,5,8,88,77,68,4,9,2,8
"24","02M393","BUSINESS OF SPORTS SCHOOL",2015,75,45,36,0,9,23,5,76,61,55,3,6,2,11
"25","02M394","EMMA LAZARUS HIGH SCHOOL",2015,59,31,31,15,0,18,9,81,55,55,33,0,12,14
"26","02M399","THE HIGH SCHOOL FOR LANGUAGE AND DIPLOMACY",2015,84,59,55,5,4,17,8,81,64,59,13,5,5,10
"27","02M400","HIGH SCHOOL FOR ENVIRONMENTAL STUDIES",2015,325,259,234,59,25,48,17,294,265,253,71,12,5,18
"28","02M407","INSTITUTE FOR COLLABORATIVE EDUCATION",2015,70,61,61,0,0,7,1,71,69,69,0,0,1,1
"29","02M408","PROFESSIONAL PERFORMING ARTS HIGH SCHOOL",2015,97,91,88,14,3,6,0,109,107,102,8,5,0,2
"30","02M411","BARUCH COLLEGE CAMPUS HIGH SCHOOL",2015,105,104,104,40,0,1,0,115,115,115,55,0,0,0
"31","02M412","N.Y.C. LAB SCHOOL FOR COLLABORATIVE STUDIES",2015,163,157,156,80,1,6,0,127,124,119,60,5,0,1
"32","02M413","SCHOOL OF THE FUTURE HIGH SCHOOL",2015,89,83,83,0,0,6,0,89,85,85,0,0,1,3
"33","02M414","N.Y.C. MUSEUM SCHOOL",2015,110,109,109,64,0,1,0,125,124,121,62,3,1,0
"34","02M416","ELEANOR ROOSEVELT HIGH SCHOOL",2015,129,129,129,117,0,0,0,122,122,122,101,0,0,0
"35","02M418","MILLENNIUM HIGH SCHOOL",2015,152,149,149,81,0,2,1,179,178,177,105,1,0,1
"36","02M419","LANDMARK HIGH SCHOOL",2015,94,38,38,0,0,34,17,95,54,51,0,3,1,38
"37","02M420","HIGH SCHOOL FOR HEALTH PROFESSIONS AND HUMAN SERVICES",2015,449,385,354,147,31,53,9,363,327,311,73,16,6,27
"38","02M422","QUEST TO LEARN",2015,1,NA,NA,NA,NA,NA,NA,NA,NA,NA,NA,NA,NA,NA
"39","02M425","LEADERSHIP AND PUBLIC SERVICE HIGH SCHOOL",2015,162,97,84,2,13,45,15,135,108,92,7,16,3,19
"40","02M427","MANHATTAN ACADEMY FOR ARTS & LANGUAGE",2015,88,43,43,1,0,21,21,3,NA,NA,NA,NA,NA,NA
"41","02M429","LEGACY SCHOOL FOR INTEGRATED STUDIES",2015,19,NA,NA,NA,NA,NA,NA,83,43,38,0,5,3,34
"42","02M432","MURRAY HILL ACADEMY",2015,79,50,40,1,10,12,15,35,17,15,0,2,4,14
"43","02M437","HUDSON HIGH SCHOOL OF LEARNING TECHNOLOGIES",2015,117,76,65,0,11,35,5,NA,NA,NA,NA,NA,NA,NA
"44","02M438","INTERNATIONAL HIGH SCHOOL AT UNION SQUARE",2015,78,38,37,0,1,26,13,2,NA,NA,NA,NA,NA,NA
"45","02M439","MANHATTAN VILLAGE ACADEMY",2015,81,79,78,75,1,1,1,113,113,113,93,0,0,0
"46","02M449","VANGUARD HIGH SCHOOL",2015,115,82,82,0,0,21,11,94,75,74,0,1,5,11
"47","02M459","MANHATTAN INTERNATIONAL HIGH SCHOOL",2015,70,46,46,0,0,22,2,71,61,60,0,1,2,7
"48","02M460","WASHINGTON IRVING HIGH SCHOOL",2015,85,43,38,0,5,12,26,256,150,141,2,9,12,78
"49","02M475","STUYVESANT HIGH SCHOOL",2015,802,772,772,764,0,29,1,838,835,835,812,0,0,2
"50","02M489","HIGH SCHOOL OF ECONOMICS AND FINANCE",2015,199,135,132,18,3,45,19,161,136,126,17,10,1,21
"51","02M500","UNITY CENTER FOR URBAN TECHNOLOGIES",2015,42,33,25,2,8,5,4,83,58,47,0,11,5,19
"52","02M507","URBAN ASSEMBLY GATEWAY SCHOOL FOR TECHNOLOGY",2015,117,98,93,13,5,13,4,NA,NA,NA,NA,NA,NA,NA
"53","02M519","TALENT UNLIMITED HIGH SCHOOL",2015,84,79,79,18,0,5,0,71,71,71,27,0,0,0
"54","02M520","MURRY BERGTRAUM HIGH SCHOOL FOR BUSINESS CAREERS",2015,310,141,130,3,11,125,42,499,331,307,14,24,44,106
"55","02M529","JACQUELINE KENNEDY ONASSIS HIGH SCHOOL",2015,183,115,108,5,7,46,19,172,133,122,15,11,7,31
"56","02M531","REPERTORY COMPANY HIGH SCHOOL FOR THEATRE ARTS",2015,57,57,56,7,1,0,0,45,44,44,1,0,0,1
"57","02M533","UNION SQUARE ACADEMY FOR HEALTH SCIENCES",2015,1,NA,NA,NA,NA,NA,NA,NA,NA,NA,NA,NA,NA,NA
"58","02M534","HARVEST COLLEGIATE HIGH SCHOOL",2015,3,NA,NA,NA,NA,NA,NA,NA,NA,NA,NA,NA,NA,NA
"59","02M542","MANHATTAN BRIDGES HIGH SCHOOL",2015,122,112,110,52,2,8,0,143,128,128,25,0,3,12
"60","02M543","NEW DESIGN HIGH SCHOOL",2015,99,73,64,0,9,10,13,89,81,71,0,10,0,6
"61","02M544","INDEPENDENCE HIGH SCHOOL",2015,133,11,10,1,1,73,49,200,64,55,1,9,33,80
"62","02M545","HIGH SCHOOL FOR DUAL LANGUAGE AND ASIAN STUDIES",2015,97,90,90,78,0,5,2,86,86,86,74,0,0,0
"63","02M550","LIBERTY HIGH SCHOOL ACADEMY FOR NEWCOMERS",2015,91,37,35,0,2,28,26,114,63,62,14,1,11,40
"64","02M551","NEW YORK HARBOR SCHOOL",2015,104,80,80,10,0,21,3,77,67,61,4,6,3,7
"65","02M560","HIGH SCHOOL M560 - CITY AS SCHOOL",2015,235,84,84,0,0,133,15,305,176,175,0,1,62,64
"66","02M565","URBAN ACADEMY LABORATORY HIGH SCHOOL",2015,32,14,14,0,0,16,2,35,20,20,0,0,12,0
"67","02M570","SATELLITE ACADEMY HIGH SCHOOL",2015,125,37,37,0,0,56,29,140,99,93,0,6,11,29
"68","02M575","MANHATTAN COMPREHENSIVE NIGHT AND DAY HIGH SCHOOL",2015,225,50,50,3,0,118,56,502,181,174,22,7,129,189
"69","02M580","RICHARD R. GREEN HIGH SCHOOL OF TEACHING",2015,122,75,71,1,4,31,13,134,94,88,6,6,3,19
"70","02M586","HARVEY MILK HIGH SCHOOL",2015,31,8,8,0,0,17,6,53,27,24,0,3,2,23
"71","02M600","THE HIGH SCHOOL OF FASHION INDUSTRIES",2015,360,294,286,70,8,54,10,356,336,323,42,13,5,12
"72","02M605","HUMANITIES PREPARATORY ACADEMY",2015,76,54,54,0,0,17,3,54,46,46,0,0,3,5
"73","02M615","CHELSEA CAREER AND TECHNICAL EDUCATION HIGH SCHOOL",2015,97,83,75,14,8,5,8,89,74,69,24,5,0,14
"74","02M620","NORMAN THOMAS HIGH SCHOOL",2015,1,NA,NA,NA,NA,NA,NA,379,233,205,6,28,14,115
"75","02M625","HIGH SCHOOL OF GRAPHIC COMMUNICATION ARTS",2015,150,62,61,0,1,51,32,396,271,257,3,14,23,87
"76","02M630","ART AND DESIGN HIGH SCHOOL",2015,312,247,240,50,7,52,10,301,277,267,20,10,7,13
"77","02M655","LIFE SCIENCES SECONDARY SCHOOL",2015,153,123,119,23,4,18,12,126,89,84,8,5,2,28
"78","03M283","MANHATTAN THEATRE LAB HIGH SCHOOL",2015,65,32,24,0,8,20,13,67,45,39,1,6,3,16
"79","03M299","HIGH SCHOOL FOR ARTS  IMAGINATION AND INQUIRY",2015,96,71,68,0,3,16,7,109,87,69,1,18,2,17
"80","03M307","URBAN ASSEMBLY SCHOOL FOR MEDIA STUDIES  THE",2015,96,70,59,0,11,12,14,83,57,48,2,9,0,24
"81","03M402","THE URBAN ASSEMBLY SCHOOL FOR GREEN CAREERS",2015,78,50,37,0,13,18,10,89,49,35,0,14,8,30
"82","03M403","THE GLOBAL LEARNING COLLABORATIVE",2015,129,96,83,11,13,19,14,88,54,48,2,6,3,31
"83","03M404","INNOVATION DIPLOMA PLUS",2015,93,3,3,0,0,85,3,96,47,43,0,4,17,30
"84","03M415","WADLEIGH SECONDARY SCHOOL FOR THE PERFORMING & VISUAL",2015,113,64,58,1,6,42,7,78,50,47,2,3,7,12
"85","03M417","FRANK MCCOURT HIGH SCHOOL",2015,102,92,86,7,6,8,2,NA,NA,NA,NA,NA,NA,NA
"86","03M479","BEACON HIGH SCHOOL",2015,297,295,295,0,0,2,0,261,259,259,0,0,0,1
"87","03M485","FIORELLO H. LAGUARDIA HIGH SCHOOL OF MUSIC & ART AND P",2015,662,645,645,470,0,15,1,660,657,657,455,0,0,2
"88","03M492","HIGH SCHOOL FOR LAW  ADVOCACY AND COMMUNITY JUSTICE",2015,112,78,75,5,3,18,15,120,98,90,16,8,5,16
"89","03M494","HIGH SCHOOL OF ARTS AND TECHNOLOGY",2015,151,96,75,3,21,34,17,143,103,100,4,3,1,30
"90","03M505","EDWARD A. REYNOLDS WEST SIDE HIGH SCHOOL",2015,204,33,22,0,11,150,20,332,162,135,1,27,67,99
"91","03M541","MANHATTAN / HUNTER SCIENCE HIGH SCHOOL",2015,107,106,106,18,0,1,0,116,111,111,29,0,3,2
"92","03M860","FREDERICK DOUGLASS ACADEMY II SECONDARY SCHOOL",2015,69,35,29,1,6,27,5,75,53,46,2,7,4,17
"93","04M372","ESPERANZA PREPARATORY ACADEMY",2015,2,NA,NA,NA,NA,NA,NA,NA,NA,NA,NA,NA,NA,NA
"94","04M409","COALITION SCHOOL FOR SOCIAL CHANGE",2015,83,27,20,0,7,28,19,94,49,42,0,7,9,32
"95","04M435","MANHATTAN CENTER FOR SCIENCE AND MATHEMATICS",2015,361,330,329,188,1,29,1,434,410,401,178,9,4,11
"96","04M495","PARK EAST HIGH SCHOOL",2015,96,92,89,10,3,3,1,87,72,66,3,6,3,10
"97","04M555","CENTRAL PARK EAST HIGH SCHOOL",2015,96,93,91,26,2,1,1,86,84,78,19,6,0,2
"98","04M610","YOUNG WOMEN'S LEADERSHIP SCHOOL",2015,71,70,68,21,2,1,0,67,67,62,20,5,0,0
"99","04M680","HERITAGE SCHOOL  THE",2015,81,48,41,2,7,17,14,63,45,42,2,3,2,11
"100","05M285","HARLEM RENAISSANCE HIGH SCHOOL",2015,83,19,17,0,2,55,7,123,54,41,0,13,20,48
"101","05M304","MOTT HALL HIGH SCHOOL",2015,102,68,54,3,14,21,7,96,84,78,7,6,0,10
"102","05M362","COLUMBIA SECONDARY SCHOOL",2015,85,84,83,43,1,1,0,NA,NA,NA,NA,NA,NA,NA
"103","05M367","ACADEMY FOR SOCIAL ACTION: A COLLEGE BOARD SCHOOL",2015,48,28,17,0,11,18,2,69,48,40,7,8,9,10
"104","05M369","URBAN ASSEMBLY SCHOOL FOR THE PERFORMING ARTS",2015,88,68,61,0,7,7,12,60,49,39,0,10,0,10
"105","05M469","CHOIR ACADEMY OF HARLEM",2015,26,10,8,0,2,6,10,25,16,15,0,1,4,5
"106","05M499","FREDERICK DOUGLASS ACADEMY",2015,237,151,146,48,5,69,14,252,224,223,54,1,2,22
"107","05M670","THURGOOD MARSHALL ACADEMY FOR LEARNING AND SOCIAL CHAN",2015,85,66,56,0,10,18,1,101,95,85,2,10,1,5
"108","05M685","BREAD & ROSES INTEGRATED ARTS HIGH SCHOOL",2015,83,29,20,0,9,16,31,109,52,46,0,6,10,38
"109","05M692","HIGH SCHOOL FOR MATHEMATICS  SCIENCE AND ENGINEERING A",2015,95,93,93,84,0,0,2,93,92,92,82,0,0,1
"110","06M293","CITY COLLEGE ACADEMY OF THE ARTS",2015,86,81,81,16,0,5,0,80,78,74,13,4,2,0
"111","06M346","COMMUNITY HEALTH ACADEMY OF THE HEIGHTS",2015,75,40,35,1,5,31,3,77,57,51,3,6,7,11
"112","06M348","WASHINGTON HEIGHTS EXPEDITIONARY LEARNING SCHOOL",2015,77,50,47,10,3,24,3,84,75,68,13,7,3,5
"113","06M423","HIGH SCHOOL FOR EXCELLENCE AND INNOVATION",2015,64,15,12,0,3,33,16,75,46,40,0,6,6,21
"114","06M462","THE COLLEGE ACADEMY",2015,135,62,54,2,8,41,17,160,120,114,4,6,8,21
"115","06M463","HIGH SCHOOL FOR MEDIA AND COMMUNICATIONS",2015,113,57,51,0,6,31,22,113,79,76,4,3,2,29
"116","06M467","HIGH SCHOOL FOR LAW AND PUBLIC SERVICE",2015,184,115,107,0,8,39,20,138,100,89,3,11,7,25
"117","06M468","HIGH SCHOOL FOR HEALTH CAREERS AND SCIENCES",2015,130,85,76,1,9,23,13,154,99,92,10,7,10,35
"118","06M540","A. PHILIP RANDOLPH CAMPUS HIGH SCHOOL",2015,224,168,168,22,0,41,5,328,284,283,30,1,5,26
"119","06M552","GREGORIO LUPERON HIGH SCHOOL FOR SCIENCE AND MATHEMATI",2015,93,64,62,9,2,19,10,153,110,104,25,6,8,29
"120","07X221","SOUTH BRONX PREPARATORY: A COLLEGE BOARD SCHOOL",2015,78,72,66,8,6,4,2,80,72,64,5,8,3,5
"121","07X321","CROTONA ACADEMY HIGH SCHOOL",2015,35,4,4,0,0,24,6,83,44,42,0,2,12,27
"122","07X334","INTERNATIONAL COMMUNITY HIGH SCHOOL",2015,91,48,47,2,1,39,4,114,52,49,2,3,20,42
"123","07X379","JILL CHAIFETZ TRANSFER HIGH SCHOOL",2015,82,16,13,0,3,52,13,84,40,37,1,3,9,35
"124","07X381","BRONX HAVEN HIGH SCHOOL",2015,78,9,6,0,3,51,18,79,32,25,0,7,20,27
"125","07X427","COMMUNITY SCHOOL FOR SOCIAL JUSTICE",2015,73,40,38,0,2,16,16,71,55,52,0,3,0,14
"126","07X473","MOTT HAVEN VILLAGE PREPARATORY HIGH SCHOOL",2015,88,40,38,0,2,33,9,96,64,59,0,5,9,16
"127","07X495","UNIVERSITY HEIGHTS SECONDARY SCHOOL",2015,115,103,103,0,0,10,1,130,117,116,0,1,1,11
"128","07X500","HOSTOS-LINCOLN ACADEMY OF SCIENCE",2015,76,60,58,13,2,13,3,72,65,60,9,5,1,6
"129","07X520","FOREIGN LANGUAGE ACADEMY OF GLOBAL STUDIES",2015,44,17,15,0,2,16,9,90,52,50,0,2,11,13
"130","07X522","BRONX DESIGN AND CONSTRUCTION ACADEMY",2015,118,47,35,0,12,45,25,2,NA,NA,NA,NA,NA,NA
"131","07X527","BRONX LEADERSHIP ACADEMY II HIGH SCHOOL",2015,121,70,66,10,4,31,19,96,67,59,2,8,3,25
"132","07X547","NEW EXPLORERS HIGH SCHOOL",2015,123,67,62,1,5,37,12,86,53,42,0,11,6,22
"133","07X548","URBAN ASSEMBLY SCHOOL FOR CAREERS IN SPORTS",2015,137,102,96,7,6,27,4,99,80,61,4,19,7,11
"134","07X551","THE URBAN ASSEMBLY BRONX ACADEMY OF LETTERS",2015,82,48,44,0,4,26,6,76,71,62,1,9,1,3
"135","07X557","MOTT HAVEN COMMUNITY HIGH SCHOOL",2015,80,12,12,0,0,50,17,71,29,18,0,11,13,28
"136","07X600","ALFRED E. SMITH CAREER AND TECHNICAL EDUCATION HIGH SC",2015,54,34,27,3,7,8,10,187,125,109,5,16,11,46
"137","07X655","SAMUEL GOMPERS CAREER AND TECHNICAL EDUCATION HIGH SCH",2015,62,29,27,3,2,0,23,178,76,69,4,7,13,52
"138","07X670","HEALTH OPPORTUNITIES HIGH SCHOOL",2015,133,77,68,6,9,28,25,140,103,92,6,11,9,26
"139","08X269","BRONX STUDIO SCHOOL FOR WRITERS AND ARTISTS",2015,66,39,37,0,2,18,7,74,57,54,0,3,1,13
"140","08X282","WOMEN'S ACADEMY OF EXCELLENCE",2015,93,53,51,5,2,28,12,86,65,60,4,5,5,14
"141","08X293","RENAISSANCE HIGH SCHOOL FOR MUSICAL THEATER & TECHNOLO",2015,129,93,89,2,4,23,11,102,88,83,3,5,1,11
"142","08X295","GATEWAY SCHOOL FOR ENVIRONMENTAL RESEARCH AND TECHNOLO",2015,39,19,14,0,5,1,18,116,59,48,2,11,12,40
"143","08X305","PABLO NERUDA ACADEMY",2015,83,44,26,2,18,20,18,89,58,47,2,11,3,26
"144","08X312","MILLENNIUM ART ACADEMY",2015,129,78,71,9,7,33,18,111,81,77,0,4,6,24
"145","08X332","HOLCOMBE L. RUCKER SCHOOL OF COMMUNITY RESEARCH",2015,74,44,38,0,6,17,12,81,56,48,0,8,3,20
"146","08X367","ARCHIMEDES ACADEMY FOR MATH  SCIENCE AND TECHNOLOGY AP",2015,86,47,40,0,7,30,7,1,NA,NA,NA,NA,NA,NA
"147","08X376","ANTONIA PANTOJA PREPARATORY ACADEMY: A COLLEGE BOARD S",2015,68,42,38,4,4,21,4,4,NA,NA,NA,NA,NA,NA
"148","08X377","BRONX COMMUNITY HIGH SCHOOL",2015,75,13,12,0,1,50,12,94,33,32,0,1,9,51
"149","08X405","HERBERT H. LEHMAN HIGH SCHOOL",2015,620,214,194,21,20,253,143,886,575,518,85,57,44,222
"150","08X432","BRONX BRIDGES HIGH SCHOOL",2015,86,42,37,0,5,30,8,NA,NA,NA,NA,NA,NA,NA
"151","08X452","BRONX GUILD",2015,61,35,25,0,10,10,13,84,56,42,0,14,8,13
"152","08X519","FELISA RINCON DE GAUTIER INSTITUTE FOR LAW AND PUBLIC",2015,94,37,32,0,5,32,24,104,53,48,0,5,1,37
"153","08X530","BANANA KELLY HIGH SCHOOL",2015,106,45,34,0,11,40,21,115,65,47,0,18,11,36
"154","08X537","BRONX ARENA HIGH SCHOOL",2015,56,2,2,0,0,47,7,101,30,26,0,4,28,40
"155","08X559","SCHOOL FOR TOURISM AND HOSPITALITY",2015,2,NA,NA,NA,NA,NA,NA,NA,NA,NA,NA,NA,NA,NA
"156","08X561","BRONX COMPASS HIGH SCHOOL",2015,4,NA,NA,NA,NA,NA,NA,NA,NA,NA,NA,NA,NA,NA
"157","08X650","JANE ADDAMS HIGH SCHOOL FOR ACADEMIC CAREERS",2015,87,48,34,0,14,11,21,192,102,89,1,13,12,63
"158","09X227","BRONX COLLEGIATE ACADEMY",2015,100,50,45,3,5,30,19,97,58,49,4,9,3,35
"159","09X231","EAGLE ACADEMY FOR YOUNG MEN",2015,105,67,60,2,7,28,7,75,59,53,0,6,2,12
"160","09X241","URBAN ASSEMBLY SCHOOL FOR APPLIED MATH AND SCIENCE  TH",2015,83,69,64,21,5,10,4,78,73,64,10,9,2,2
"161","09X250","EXIMIUS COLLEGE PREPARATORY ACADEMY: A COLLEGE BOARD S",2015,132,109,101,17,8,17,6,66,55,53,5,2,2,8
"162","09X252","MOTT HALL BRONX HIGH SCHOOL",2015,90,71,63,3,8,15,4,87,79,71,4,8,1,6
"163","09X260","BRONX CENTER FOR SCIENCE AND MATHEMATICS",2015,111,100,96,26,4,8,3,98,95,93,49,2,0,3
"164","09X263","VALIDUS PREPARATORY ACADEMY",2015,97,54,50,0,4,33,10,97,75,64,0,11,6,11
"165","09X276","LEADERSHIP INSTITUTE",2015,49,14,13,0,1,17,17,45,29,26,0,3,3,12
"166","09X297","MORRIS ACADEMY FOR COLLABORATIVE STUDIES",2015,140,90,81,3,9,34,16,100,69,57,2,12,7,22
"167","09X324","BRONX EARLY COLLEGE ACADEMY FOR TEACHING & LEARNING",2015,60,56,49,4,7,3,1,78,76,76,14,0,0,2
"168","09X327","COMPREHENSIVE MODEL SCHOOL PROJECT M.S. 327",2015,3,NA,NA,NA,NA,NA,NA,NA,NA,NA,NA,NA,NA,NA
"169","09X329","DREAMYARD PREPARATORY SCHOOL",2015,87,51,46,0,5,23,13,85,35,30,4,5,6,42
"170","09X365","ACADEMY FOR LANGUAGE AND TECHNOLOGY",2015,70,65,64,2,1,2,3,86,75,72,0,3,1,10
"171","09X403","BRONX INTERNATIONAL HIGH SCHOOL",2015,115,81,76,0,5,28,4,87,62,58,0,4,10,10
"172","09X404","SCHOOL FOR EXCELLENCE",2015,97,52,47,0,5,34,10,89,65,61,0,4,6,14
"173","09X412","BRONX HIGH SCHOOL OF BUSINESS",2015,90,34,32,1,2,43,13,96,53,47,0,6,18,22
"174","09X413","BRONX HIGH SCHOOL FOR MEDICAL SCIENCE",2015,86,72,72,12,0,9,2,71,68,67,12,1,1,2
"175","09X414","JONATHAN LEVIN HIGH SCHOOL FOR MEDIA AND COMMUNICATION",2015,85,35,28,1,7,29,17,104,40,36,1,4,18,42
"176","09X505","BRONX SCHOOL FOR LAW  GOVERNMENT AND JUSTICE",2015,126,90,84,0,6,26,8,113,101,97,0,4,0,10
"177","09X517","FREDERICK DOUGLASS ACADEMY III SECONDARY SCHOOL",2015,110,67,67,1,0,27,16,83,61,57,9,4,2,19
"178","09X525","BRONX LEADERSHIP ACADEMY HIGH SCHOOL",2015,169,90,81,0,9,54,15,190,120,105,8,15,8,50
"179","09X543","HIGH SCHOOL FOR VIOLIN AND DANCE",2015,108,63,55,0,8,24,13,51,32,26,1,6,4,12
"180","10X141","RIVERDALE / KINGSBRIDGE ACADEMY (MIDDLE SCHOOL / HIGH",2015,157,125,119,29,6,17,14,158,141,129,23,12,3,9
"181","10X213","BRONX ENGINEERING AND TECHNOLOGY ACADEMY",2015,92,62,58,7,4,19,10,105,82,78,9,4,5,17
"182","10X225","THEATRE ARTS PRODUCTION COMPANY SCHOOL",2015,94,71,70,0,1,18,2,79,69,60,0,9,0,7
"183","10X237","THE MARIE CURIE SCHOOL FOR MEDICINE  NURSING  AND HEAL",2015,138,92,88,7,4,36,8,119,99,88,5,11,3,16
"184","10X243","WEST BRONX ACADEMY FOR THE FUTURE",2015,80,62,58,4,4,12,4,81,65,58,5,7,5,9
"185","10X268","KINGSBRIDGE INTERNATIONAL HIGH SCHOOL",2015,73,41,39,11,2,20,10,126,72,72,14,0,5,45
"186","10X284","BRONX SCHOOL OF LAW AND FINANCE",2015,117,67,64,6,3,33,17,92,70,66,1,4,0,21
"187","10X319","PROVIDING URBAN LEARNERS SUCCESS IN EDUCATION HIGH SCH",2015,126,14,12,0,2,64,48,135,44,39,0,5,13,73
"188","10X342","INTERNATIONAL SCHOOL FOR LIBERAL ARTS",2015,104,65,65,7,0,28,10,116,88,86,14,2,3,23
"189","10X351","BRONX COLLABORATIVE HIGH SCHOOL",2015,1,NA,NA,NA,NA,NA,NA,NA,NA,NA,NA,NA,NA,NA
"190","10X368","IN-TECH ACADEMY (M.S. / HIGH SCHOOL 368)",2015,135,108,98,15,10,25,2,121,95,88,6,7,2,24
"191","10X374","KNOWLEDGE AND POWER PREPARATORY ACADEMY INTERNATIONAL",2015,90,72,69,7,3,9,9,79,71,70,6,1,1,7
"192","10X397","ENGLISH LANGUAGE LEARNERS AND INTERNATIONAL SUPPORT PR",2015,87,18,17,0,1,32,35,78,18,18,0,0,31,28
"193","10X433","HIGH SCHOOL FOR TEACHING AND THE PROFESSIONS",2015,114,61,47,0,14,35,16,132,107,92,5,15,6,17
"194","10X434","BELMONT PREPARATORY HIGH SCHOOL",2015,94,52,49,14,3,32,9,90,71,66,16,5,7,10
"195","10X437","FORDHAM HIGH SCHOOL FOR THE ARTS",2015,89,77,71,2,6,10,2,82,71,65,11,6,1,8
"196","10X438","FORDHAM LEADERSHIP ACADEMY FOR BUSINESS AND TECHNOLOGY",2015,116,48,37,0,11,40,24,104,61,52,0,9,9,30
"197","10X439","BRONX HIGH SCHOOL FOR LAW AND COMMUNITY SERVICE",2015,89,63,53,3,10,12,13,79,68,55,4,13,2,9
"198","10X440","DEWITT CLINTON HIGH SCHOOL",2015,789,327,297,58,30,208,212,1050,689,550,109,139,53,255
"199","10X442","CELIA CRUZ BRONX HIGH SCHOOL OF MUSIC  THE",2015,89,81,80,8,1,3,5,73,69,65,7,4,1,3
"200","10X445","BRONX HIGH SCHOOL OF SCIENCE",2015,737,730,730,728,0,6,1,752,751,751,749,0,1,0
"201","10X477","MARBLE HILL HIGH SCHOOL FOR INTERNATIONAL STUDIES",2015,112,103,102,22,1,7,2,116,109,108,22,1,2,5
"202","10X524","CROTONA INTERNATIONAL HIGH SCHOOL",2015,100,39,39,0,0,37,24,NA,NA,NA,NA,NA,NA,NA
"203","10X546","BRONX THEATRE HIGH SCHOOL",2015,102,63,50,0,13,29,8,101,79,73,2,6,8,10
"204","10X549","DISCOVERY HIGH SCHOOL",2015,147,84,83,42,1,44,18,127,87,83,40,4,11,26
"205","10X565","HIGH SCHOOL FOR ENERGY AND TECHNOLOGY",2015,1,NA,NA,NA,NA,NA,NA,NA,NA,NA,NA,NA,NA,NA
"206","10X660","GRACE DODGE CAREER AND TECHNICAL EDUCATION HIGH SCHOOL",2015,104,53,45,0,8,1,41,291,137,115,2,22,27,115
"207","10X696","HIGH SCHOOL OF AMERICAN STUDIES AT LEHMAN COLLEGE",2015,97,96,96,89,0,1,0,94,94,94,81,0,0,0
"208","11X249","BRONX HEALTH SCIENCES HIGH SCHOOL",2015,85,82,80,16,2,2,1,57,56,56,4,0,1,0
"209","11X253","BRONX HIGH SCHOOL FOR WRITING AND COMMUNICATION ARTS",2015,112,58,52,0,6,25,22,108,65,59,2,6,7,28
"210","11X265","BRONX LAB SCHOOL",2015,123,92,86,0,6,22,9,113,85,78,0,7,9,18
"211","11X270","ACADEMY FOR SCHOLARSHIP AND ENTRENEURSHIP",2015,101,59,52,2,7,31,10,79,69,58,3,11,0,7
"212","11X275","HIGH SCHOOL OF COMPUTERS AND TECHNOLOGY",2015,126,93,92,19,1,31,1,121,110,105,19,5,0,11
"213","11X288","COLLEGIATE INSTITUTE FOR MATH AND SCIENCE",2015,163,134,129,57,5,12,12,147,130,124,44,6,5,9
"214","11X290","BRONX ACADEMY OF HEALTH CAREERS",2015,133,88,85,7,3,34,10,115,90,83,5,7,7,15
"215","11X299","ASTOR COLLEGIATE ACADEMY",2015,124,83,75,9,8,31,8,116,90,83,6,7,5,19
"216","11X418","BRONX HIGH SCHOOL FOR THE VISUAL ARTS",2015,119,59,52,2,7,29,22,115,88,80,6,8,5,14
"217","11X455","HARRY S TRUMAN HIGH SCHOOL",2015,415,256,248,20,8,67,74,426,286,255,22,31,14,110
"218","11X508","BRONXDALE HIGH SCHOOL",2015,91,71,64,3,7,13,5,1,NA,NA,NA,NA,NA,NA
"219","11X509","HIGH SCHOOL OF LANGUAGE AND INNOVATION",2015,89,58,57,15,1,23,8,NA,NA,NA,NA,NA,NA,NA
"220","11X513","NEW WORLD HIGH SCHOOL",2015,84,74,74,18,0,10,0,77,70,70,10,0,1,6
"221","11X514","THE BRONXWOOD PREPARATORY ACADEMY",2015,118,73,61,4,12,25,15,89,65,55,0,10,12,12
"222","11X542","PELHAM PREPARATORY ACADEMY",2015,111,94,85,10,9,6,4,113,110,105,17,5,1,2
"223","11X544","HIGH SCHOOL FOR CONTEMPORARY ARTS",2015,144,80,71,1,9,40,20,124,89,84,0,5,4,29
"224","11X545","BRONX AEROSPACE HIGH SCHOOL",2015,103,70,56,0,14,17,15,84,63,47,0,16,6,13
"225","12X242","MOTT HALL V",2015,79,57,55,22,2,19,3,2,NA,NA,NA,NA,NA,NA
"226","12X248","METROPOLITAN HIGH SCHOOL  THE",2015,87,52,49,3,3,22,10,97,71,59,2,12,1,20
"227","12X251","EXPLORATIONS ACADEMY",2015,92,51,43,0,8,21,19,98,65,56,2,9,4,28
"228","12X267","BRONX LATIN",2015,58,49,43,7,6,4,4,40,29,28,3,1,0,8
"229","12X271","EAST BRONX ACADEMY FOR THE FUTURE",2015,98,68,61,4,7,17,12,103,77,68,3,9,2,21
"230","12X278","PEACE AND DIVERSITY ACADEMY",2015,57,13,13,0,0,25,18,72,37,36,0,1,10,23
"231","12X372","URBAN ASSEMBLY SCHOOL FOR WILDLIFE CONSERVATION",2015,83,64,52,3,12,14,3,2,NA,NA,NA,NA,NA,NA
"232","12X388","PAN AMERICAN INTERNATIONAL HIGH SCHOOL AT MONROE",2015,89,72,69,0,3,11,5,71,60,60,0,0,5,6
"233","12X446","ARTURO A. SCHOMBURG SATELLITE ACADEMY BRONX",2015,79,13,12,0,1,55,11,152,67,65,0,2,23,62
"234","12X478","THE CINEMA SCHOOL",2015,94,89,88,4,1,3,2,74,72,71,16,1,0,2
"235","12X479","BRONX CAREER AND COLLEGE PREPARATORY HIGH SCHOOL",2015,91,40,37,0,3,25,15,67,53,44,0,9,6,6
"236","12X480","BRONX REGIONAL HIGH SCHOOL",2015,106,8,8,0,0,74,23,151,47,38,0,9,28,70
"237","12X511","BRONX ENVISION ACADEMY",2015,81,56,45,1,11,17,8,NA,NA,NA,NA,NA,NA,NA
"238","12X521","THE METROPOLITAN SOUNDVIEW HIGH SCHOOL",2015,100,72,70,7,2,19,6,2,NA,NA,NA,NA,NA,NA
"239","12X550","HIGH SCHOOL OF WORLD CULTURES",2015,101,48,48,2,0,38,13,110,72,68,8,4,12,24
"240","12X682","FANNIE LOU HAMER FREEDOM HIGH SCHOOL",2015,108,71,69,0,2,24,10,131,104,91,0,13,2,21
"241","12X684","WINGS ACADEMY",2015,119,64,59,4,5,43,10,95,65,58,6,7,0,25
"242","12X692","MONROE ACADEMY FOR VISUAL ARTS & DESIGN",2015,109,54,46,0,8,33,19,113,66,63,1,3,11,28
"243","13K265","DR. SUSAN S. MCKINNEY SECONDARY SCHOOL OF THE ARTS",2015,69,34,29,0,5,28,6,71,51,49,8,2,9,10
"244","13K350","URBAN ASSEMBLY HIGH SCHOOL OF MUSIC AND ART",2015,98,52,43,0,9,26,18,92,52,39,0,13,5,35
"245","13K412","BROOKLYN COMMUNITY HIGH SCHOOL OF COMMUNICATION  ARTS",2015,118,80,73,0,7,26,11,106,83,74,1,9,4,18
"246","13K419","SCIENCE SKILLS CENTER HIGH SCHOOL FOR SCIENCE  TECHNOL",2015,91,63,59,8,4,16,11,132,103,99,17,4,5,21
"247","13K430","BROOKLYN TECHNICAL HIGH SCHOOL",2015,1330,1255,1255,1172,0,69,4,1298,1281,1281,1138,0,2,12
"248","13K439","BROOKLYN INTERNATIONAL HIGH SCHOOL",2015,82,71,71,0,0,6,5,98,86,86,0,0,3,9
"249","13K483","THE URBAN ASSEMBLY SCHOOL FOR LAW AND JUSTICE",2015,105,89,89,0,0,14,2,98,92,87,0,5,1,5
"250","13K499","ACORN COMMUNITY HIGH SCHOOL",2015,150,68,63,2,5,58,23,161,128,118,7,10,9,19
"251","13K509","FREEDOM ACADEMY HIGH SCHOOL",2015,1,NA,NA,NA,NA,NA,NA,54,25,21,0,4,13,12
"252","13K527","URBAN ASSEMBLY INSTITUTE OF MATH AND SCIENCE FOR YOUNG",2015,73,62,59,0,3,7,4,62,58,55,4,3,1,3
"253","13K553","BROOKLYN ACADEMY HIGH SCHOOL",2015,70,18,14,1,4,46,6,93,42,34,0,8,18,32
"254","13K575","BEDFORD STUYVESANT PREPARATORY HIGH SCHOOL",2015,60,11,11,0,0,46,3,63,36,36,0,0,7,15
"255","13K595","BEDFORD ACADEMY HIGH SCHOOL",2015,79,76,76,47,0,3,0,103,99,98,51,1,1,3
"256","13K605","GEORGE WESTINGHOUSE CAREER AND TECHNICAL EDUCATION HIG",2015,158,101,92,1,9,49,7,216,169,153,9,16,11,28
"257","13K616","BROOKLYN HIGH SCHOOL FOR LEADERSHIP AND COMMUNITY SERV",2015,72,3,2,0,1,49,19,95,22,18,0,4,23,46
"258","13K670","BENJAMIN BANNEKER ACADEMY",2015,215,196,193,65,3,15,4,221,217,214,39,3,1,2
"259","13K674","CITY POLYTECHNIC HIGH SCHOOL OF ENGINEERING  ARCHITECT",2015,114,98,95,0,3,15,1,63,59,56,2,3,1,2
"260","14K071","JUAN MOREL CAMPOS SECONDARY SCHOOL",2015,85,36,32,0,4,31,17,102,56,50,2,6,18,24
"261","14K322","FOUNDATIONS ACADEMY",2015,36,12,8,0,4,14,10,25,11,8,0,3,2,11
"262","14K449","BROOKLYN LATIN SCHOOL  THE",2015,158,153,153,56,0,5,0,86,86,86,13,0,0,0
"263","14K454","GREEN SCHOOL: AN ACADEMY FOR ENVIRONMENTAL CAREERS",2015,95,61,61,0,0,13,19,71,44,39,0,5,5,21
"264","14K474","PROGRESS HIGH SCHOOL FOR PROFESSIONAL CAREERS",2015,286,190,183,0,7,60,33,242,177,168,6,9,15,47
"265","14K477","SCHOOL FOR LEGAL STUDIES",2015,170,73,65,2,8,53,40,187,116,110,0,6,16,51
